product,rating,price,product url
"Youth To The People Kale + Green Tea Superfood Face Cleanser - Vegan Face Wash with Spinach, Vitamins C, E + K - Non-Drying Gel Foaming Cleanser for All Skin Types - Clean Beauty (8oz)  ",4.7 out of 5 stars,2916,https://amazon.com/gp/slredirect/picassoRedirect.html/ref=pa_sp_atf_next_aps_sr_pg4_1?ie=UTF8&adId=A0376710OIIW3MBVLDE1&qualifier=1669905281&id=7486623540963506&widgetName=sp_atf_next&url=%2FYouth-People-Kale-Superfood-Cleanser%2Fdp%2FB018A0BO92%2Fref%3Dsr_1_145_sspa%3Fkeywords%3Dface%2Bwash%26qid%3D1669905281%26sr%3D8-145-spons%26psc%3D1
"Neutrogena Hydro Boost Gentle Exfoliating Daily Facial Cleanser with Hyaluronic Acid, Clinically Proven to Increase Skin's Hydration Level, Non-Comedogenic Oil-, Soap- & Paraben-Free, 3 x 5 Oz  ",4.8 out of 5 stars,2025,https://amazon.com/gp/slredirect/picassoRedirect.html/ref=pa_sp_atf_next_aps_sr_pg4_1?ie=UTF8&adId=A0913305B9TARKS23JJP&qualifier=1669905281&id=7486623540963506&widgetName=sp_atf_next&url=%2FNeutrogena-Exfoliating-Hyaluronic-Non-Comedogenic-Paraben-Free%2Fdp%2FB0B29YZH1P%2Fref%3Dsr_1_146_sspa%3Fkeywords%3Dface%2Bwash%26qid%3D1669905281%26sr%3D8-146-spons%26psc%3D1
"Eucerin Hydrating Foaming Daily Facial Cleanser with Hyaluronic Acid, 5 Fl Oz  ",4.2 out of 5 stars,810,https://amazon.com/gp/slredirect/picassoRedirect.html/ref=pa_sp_atf_next_aps_sr_pg4_1?ie=UTF8&adId=A04138042X4EHFH6GO9PM&qualifier=1669905281&id=7486623540963506&widgetName=sp_atf_next&url=%2FEucerin-Hydrating-Foaming-Cleanser-Hyaluronic%2Fdp%2FB0B283V1C9%2Fref%3Dsr_1_147_sspa%3Fkeywords%3Dface%2Bwash%26qid%3D1669905281%26sr%3D8-147-spons%26psc%3D1
Bliss Rose Gold Rescue Cleanser Gentle Foaming Face Wash | With Soothing Rose Flower Water & Willow Bark for Sensitive Skin | Clean | Cruelty Free | Paraben Free | 6.4 oz  ,4.4 out of 5 stars,729,https://amazon.com/gp/slredirect/picassoRedirect.html/ref=pa_sp_atf_next_aps_sr_pg4_1?ie=UTF8&adId=A00386713URP1W5KJJNQY&qualifier=1669905281&id=7486623540963506&widgetName=sp_atf_next&url=%2FBliss-Cleanser-Soothing-Sensitive-Cruelty-Free%2Fdp%2FB07RL48SRC%2Fref%3Dsr_1_148_sspa%3Fkeywords%3Dface%2Bwash%26qid%3D1669905281%26sr%3D8-148-spons%26psc%3D1%26smid%3DA3V5JDN84JNH2I
"Clinique Foaming Sonic Facial Soap for Unisex, 5 Ounce  ",4.7 out of 5 stars,891,https://amazon.com/Clinique-Foaming-Sonic-Facial-Unisex/dp/B00O4H6A6I/ref=sr_1_149?keywords=face+wash&qid=1669905281&sr=8-149
"Alaffia Everyday Coconut Face Cleanser for All Skin Types.  Leaves Skin Fresh and Hydrated with Fair Trade Coconut Oil & Neem, Vegan, Cruelty Free, No Parabens, Purely Coconut, 2 Pack - 12 Fl Oz Ea  ",4.7 out of 5 stars,1701,https://amazon.com/Alaffia-Everyday-Coconut-Cleanser-Purely/dp/B0992NR2V6/ref=sr_1_151?keywords=face+wash&qid=1669905281&sr=8-151
"Natural Outcome Charcoal Face Wash | Daily Detoxifying Charcoal Cleanser for Acne | Deep Pore Cleanser Hydrates & Purifies Skin with Green Tea, Aloe Vera, & Ginkgo Biloba | For Men & Women | 8 oz  ",4.7 out of 5 stars,729,https://amazon.com/Charcoal-Detoxifying-Cleanser-Hydrates-Purifies/dp/B0BBXLP43J/ref=sr_1_152?keywords=face+wash&qid=1669905281&sr=8-152
"Bevel Face Wash with Tea Tree Oil, Witch Hazel and Aloe Vera to Cleanse, Hydrate and Brighten Skin, 4 Fl Oz  ",4.6 out of 5 stars,810,https://amazon.com/Bevel-800200-Face-Wash-fl/dp/B07DHRFK1Y/ref=sr_1_153?keywords=face+wash&qid=1669905281&sr=8-153
"Hada Labo Tokyo Gentle Hydrating Foaming Facial Cleanser Tube, Unscented 5 Ounce  ",4.6 out of 5 stars,972,https://amazon.com/Hada-Labo-Tokyo-Hydrating-Cleanser/dp/B01AAX6C26/ref=sr_1_154?keywords=face+wash&qid=1669905281&sr=8-154
"Clean & Clear Deep Action Cream Cleanser, Oil-Free, Travel Size 1 oz (28g) - Pack of 3  ",4.6 out of 5 stars,567,https://amazon.com/Clean-Clear-Action-Cleanser-Travel/dp/B01BWYLMHW/ref=sr_1_156?keywords=face+wash&qid=1669905281&sr=8-156
"PanOxyl Antimicrobial Acne Creamy Wash, 4% Benzoyl Peroxide, 6 Ounce  ",4.6 out of 5 stars,729,https://amazon.com/PanOxyl-Benzoyl-Peroxide-Control-Antimicrobial/dp/B081KLNHSG/ref=sr_1_157?keywords=face+wash&qid=1669905281&sr=8-157
HADA LABO Goku-jyun Foaming Face Wash - 5.4 fl oz (160 mL) Bottle  ,4.6 out of 5 stars,648,https://amazon.com/HADA-LABO-Goku-jyun-Foaming-Face/dp/B01CE5P580/ref=sr_1_158?keywords=face+wash&qid=1669905281&sr=8-158
"Earth to Skin Honey Manuka Cleanser Nettoyant, 4.74 oz  ",4.8 out of 5 stars,810,https://amazon.com/Earth-Honey-Manuka-Cleanser-Nettoyant/dp/B07W4LQGPX/ref=sr_1_159?keywords=face+wash&qid=1669905281&sr=8-159
"Face Wash by CETAPHIL, Hydrating Gentle Skin Cleanser for Dry to Normal Sensitive Skin, NEW 4 oz 3 Pack, Fragrance Free, Soap Free and Non-Foaming  ",4.6 out of 5 stars,1215,https://amazon.com/CETAPHIL-Hydrating-Sensitive-Fragrance-Non-Foaming/dp/B09FCMSV5J/ref=sr_1_160?keywords=face+wash&qid=1669905281&sr=8-160
"Saturday Skin Face Cleanser Hydrating Foam Cleanser Natural ingredients Anti-aging | Makeup Remover and Face Wash | Fragrance Free Ideal for Sensitive, Dry Skin Shine Skin Cleanser Skin Rise  ",4.7 out of 5 stars,2106,https://amazon.com/gp/slredirect/picassoRedirect.html/ref=pa_sp_mtf_aps_sr_pg4_1?ie=UTF8&adId=A03014143J73PKDHKE9N&qualifier=1669905281&id=7486623540963506&widgetName=sp_mtf&url=%2FSaturday-Skin-Hydrating-ingredients-Anti-aging%2Fdp%2FB085KX1SRX%2Fref%3Dsr_1_161_sspa%3Fkeywords%3Dface%2Bwash%26qid%3D1669905281%26sr%3D8-161-spons%26psc%3D1
Ultra Gentle Hydrating Daily Facial Cleanser for Sensitive Skin  ,4.5 out of 5 stars,810,https://amazon.com/gp/slredirect/picassoRedirect.html/ref=pa_sp_mtf_aps_sr_pg4_1?ie=UTF8&adId=A06468453E6T8G2B1EBUP&qualifier=1669905281&id=7486623540963506&widgetName=sp_mtf&url=%2FGentle-Hydrating-Facial-Cleanser-Sensitive%2Fdp%2FB085S7FZTM%2Fref%3Dsr_1_163_sspa%3Fkeywords%3Dface%2Bwash%26qid%3D1669905281%26sr%3D8-163-spons%26psc%3D1
"innisfree Cherry Blossom Dewy Glow Jam Cleanser Daily Face Wash, 32 Fl Oz (Pack of 1)  ",4.7 out of 5 stars,1053,https://amazon.com/gp/slredirect/picassoRedirect.html/ref=pa_sp_mtf_aps_sr_pg4_1?ie=UTF8&adId=A0738124139YCA7NOO4VM&qualifier=1669905281&id=7486623540963506&widgetName=sp_mtf&url=%2Finnisfree-Cherry-Blossom-Cleanser-Daily%2Fdp%2FB08YL7BHVQ%2Fref%3Dsr_1_164_sspa%3Fkeywords%3Dface%2Bwash%26qid%3D1669905281%26sr%3D8-164-spons%26psc%3D1
"Organic Facial Cleanser - Anti Aging Vitamin C Face Wash - Breakout & Blemish - Clear Pores on Oily, Dry & Sensitive Skin with Organic Ingredients - Gentle, Brightening & Hydrating Face Wash - 4.05 oz  ",3.9 out of 5 stars,1134,https://amazon.com/Organic-Facial-Cleanser-Ingredients-Brightening/dp/B0B25RLXT5/ref=sr_1_166?keywords=face+wash&qid=1669905281&sr=8-166
"Advanced Clinicals Face Wash Brightening Vitamin C Facial Cleanser – Gentle Blackhead Facial Wash Hydrates Dry Skin, Daily Pore Minimizer For Age Spots, Hyperpigmentation, Acne, & Wrinkles, 8.2 Fl Oz  ",4.3 out of 5 stars,729,https://amazon.com/Advanced-Clinicals-Brightening-Vitamin-Cleanser/dp/B09JJ1ZP25/ref=sr_1_167?keywords=face+wash&qid=1669905281&sr=8-167
"Bioré Clean Detox Gentle Face Cleanser, Daily Face Wash, Cleansing Detox, Sensitive Skin Cleanser, 6.77 oz (2811802)  ",4.1 out of 5 stars,486,https://amazon.com/Bior%C3%A9-Cleanser-Cleansing-Sensitive-2811802/dp/B0B5YNBVFT/ref=sr_1_168?keywords=face+wash&qid=1669905281&sr=8-168
"Aveeno Calm + Restore Nourishing Oat Facial Cleanser for Sensitive Skin, Gentle Face Wash with Nourishing Oat & Calming Feverfew, Hypoallergenic, Fragrance-Free, Refill Pouch, 16 fl. Oz  ",4.6 out of 5 stars,1053,https://amazon.com/Aveeno-Nourishing-Sensitive-Hypoallergenic-Fragrance-Free/dp/B0B2HTX6JF/ref=sr_1_169?keywords=face+wash&qid=1669905281&sr=8-169
"Origins Checks and Balances Frothy Face Wash 5oz, 150ml Skincare Cleansers  ",4.8 out of 5 stars,2268,https://amazon.com/Origins-Checks-Balances-Skincare-Cleansers/dp/B00FJ3MVLY/ref=sr_1_170?keywords=face+wash&qid=1669905281&sr=8-170
"Neutrogena Skin Balancing Purifying Gel Cleanser with 2% Polyhydroxy Acid (PHA), Softening Face Wash for Normal & Combo Skin, Paraben-Free, Soap-Free, Sulfate-Free, 6.3 oz  ",4.5 out of 5 stars,648,https://amazon.com/Neutrogena-Balancing-Polyhydroxy-Paraben-Free-Sulfate-Free/dp/B088S15MCJ/ref=sr_1_171?keywords=face+wash&qid=1669905281&sr=8-171
"Honest Beauty Gentle Gel Cleanser with Chamomile & Calendula Extracts, Sulfate Free, Paraben Free, 5.0 Fl Oz  ",4.6 out of 5 stars,972,https://amazon.com/Honest-Beauty-Gentle-Cleanser-Fluid/dp/B07F458BRP/ref=sr_1_172?keywords=face+wash&qid=1669905281&sr=8-172
Neutrogena Naturals Purifying Facial Cleanser  ,4.8 out of 5 stars,2349,https://amazon.com/Neutrogena-Naturals-Purifying-Cleanser-Worldwide/dp/B00FRBDWCA/ref=sr_1_174?keywords=face+wash&qid=1669905281&sr=8-174
"Neutrogena Ultra Gentle Daily Facial Cleanser with Pro-Vitamin B5 for Acne-Prone & Sensitive Skin, Fragrance-Free, Dye-Free, Soap-Free, Paraben-Free & Hypoallergenic Face Wash, 16 fl. oz  ",4.3 out of 5 stars,810,https://amazon.com/Neutrogena-Pro-Vitamin-Fragrance-Free-Paraben-Free-Hypoallergenic/dp/B08XC5NDJR/ref=sr_1_176?keywords=face+wash&qid=1669905281&sr=8-176
"Bioré Rose Quartz + Charcoal Daily Face Wash, Oil Free Facial Cleanser Energizes Skin, Dermatologist Tested and Cruelty Free, 6.77 Ounces (Pack of 3)  ",4.6 out of 5 stars,1620,https://amazon.com/gp/slredirect/picassoRedirect.html/ref=pa_sp_mtf_aps_sr_pg4_1?ie=UTF8&adId=A06164507C13H6RZRZJ7&qualifier=1669905281&id=7486623540963506&widgetName=sp_mtf&url=%2FBior%25C3%25A9-Charcoal-Cleanser-Energizes-Dermatologist%2Fdp%2FB08XZL9Z8F%2Fref%3Dsr_1_177_sspa%3Fkeywords%3Dface%2Bwash%26qid%3D1669905281%26sr%3D8-177-spons%26psc%3D1
"UMICKOO Facial Cleansing Brush,Rechargeable IPX7 Waterproof with 5 Brush Heads,Face Brush Use for Exfoliating, Massaging and Deep Cleansing (Mint-Green)  ",4.4 out of 5 stars,2754,https://amazon.com/gp/slredirect/picassoRedirect.html/ref=pa_sp_mtf_aps_sr_pg4_1?ie=UTF8&adId=A0405049JQ70QREWCMMD&qualifier=1669905281&id=7486623540963506&widgetName=sp_mtf&url=%2FCleansing-Rechargeable-Waterproof-Exfoliating-Mint-Green%2Fdp%2FB095YHM558%2Fref%3Dsr_1_178_sspa%3Fkeywords%3Dface%2Bwash%26qid%3D1669905281%26sr%3D8-178-spons%26psc%3D1
"Bioré Deep Pore Charcoal Face Wash, Facial Cleanser for Dirt and Makeup Removal From Oily Skin, 6.77 Ounce  ",4.6 out of 5 stars,486,https://amazon.com/gp/slredirect/picassoRedirect.html/ref=pa_sp_mtf_aps_sr_pg4_1?ie=UTF8&adId=A04198001663DQDPDDL2P&qualifier=1669905281&id=7486623540963506&widgetName=sp_mtf&url=%2FBior%25C3%25A9-Charcoal-Naturally-Dermatologist-Packaging%2Fdp%2FB00L2BSI64%2Fref%3Dsr_1_179_sspa%3Fkeywords%3Dface%2Bwash%26qid%3D1669905281%26sr%3D8-179-spons%26psc%3D1
"Honest Beauty Gentle Gel Cleanser with Chamomile & Calendula Extracts, Sulfate Free, Paraben Free, 5.0 Fl Oz  ",4.6 out of 5 stars,972,https://amazon.com/gp/slredirect/picassoRedirect.html/ref=pa_sp_mtf_aps_sr_pg4_1?ie=UTF8&adId=A091974439D1FKD04WQC4&qualifier=1669905281&id=7486623540963506&widgetName=sp_mtf&url=%2FHonest-Beauty-Gentle-Cleanser-Fluid%2Fdp%2FB07F458BRP%2Fref%3Dsr_1_180_sspa%3Fkeywords%3Dface%2Bwash%26qid%3D1669905281%26sr%3D8-180-spons%26psc%3D1
Gentle Kids Foaming Face Wash Organic – Natural - Vegan - Toxin-Free - Sulphate Free – Paraben Free - For Kids and Preteens  ,4.5 out of 5 stars,1296,https://amazon.com/Gentle-Kids-Foaming-Face-Organic/dp/B06XZD5PMT/ref=sr_1_181?keywords=face+wash&qid=1669905281&sr=8-181
"Cocokind AHA Jelly Cleanser, Gentle Face Wash and AHA BHA Cleanser with Hyaluronic Acid, Exfoliating Face Wash for Oily Skin  ",3.9 out of 5 stars,1377,https://amazon.com/Cocokind-AHA-Jelly-Cleanser-2-9/dp/B0864Z784S/ref=sr_1_182?keywords=face+wash&qid=1669905281&sr=8-182
"Tree to Tub Sensitive Skin Face Wash for Dry Skin - Fragrance Free Gentle Face Cleanser for Women & Men, Unscented Hydrating Foaming Facial Cleanser, Daily Face Soap w/ All Natural Organic Aloe Vera  ",4.5 out of 5 stars,1539,https://amazon.com/Gentle-Face-Wash-Dry-Skin/dp/B075FGKYMP/ref=sr_1_184?keywords=face+wash&qid=1669905281&sr=8-184
"Curel Japanese Skin Care Foaming Daily Face Wash for Sensitive Skin, Hydrating Facial Cleanser for Dry Skin, pH-Balanced and Fragrance-Free, 5 Ounces (Step 2 of 2-Step Skincare)  ",4.5 out of 5 stars,1053,https://amazon.com/Hydrating-pH-Balanced-Fragrance-Free-Sensitive-Skincare/dp/B0869KN3TK/ref=sr_1_185?keywords=face+wash&qid=1669905281&sr=8-185
"CeraVe Acne Foaming Cream Cleanser | Acne Treatment Face Wash with 4% Benzoyl Peroxide, Hyaluronic Acid, and Niacinamide | Cream to Foam Formula | Fragrance Free & Non Comedogenic | 5 Oz  ",4.6 out of 5 stars,1053,https://amazon.com/CeraVe-Treatment-Hyaluronic-Niacinamide-Sensitive/dp/B07YLJPMC3/ref=sr_1_186?keywords=face+wash&qid=1669905281&sr=8-186
"Bombay Shaving Company Coffee Face Wash for Men & Women - Deep-Cleanses, De-Tans & Blackhead Removal | Made in India  ",4.0 out of 5 stars,810,https://amazon.com/Bombay-Shaving-Company-Coffee-Women/dp/B08MQJPWBV/ref=sr_1_187?keywords=face+wash&qid=1669905281&sr=8-187
"Cetaphil Daily Facial Cleanser for Normal to Oily Skin, 8 Ounce  ",4.7 out of 5 stars,729,https://amazon.com/Cetaphil-Daily-Facial-Cleanser-Normal/dp/B000056I89/ref=sr_1_188?keywords=face+wash&qid=1669905281&sr=8-188
Garnier Light Face Wash 100g  ,4.3 out of 5 stars,486,https://amazon.com/Garnier-Light-Face-Wash-100g/dp/B006LX9K92/ref=sr_1_189?keywords=face+wash&qid=1669905281&sr=8-189
"Alba Botanica Acnedote Maximum Strength Deep Pore Wash, 6 Oz  ",4.7 out of 5 stars,648,https://amazon.com/Alba-Botanica-Acnedote-Maximum-Strength/dp/B003O3XXZY/ref=sr_1_190?keywords=face+wash&qid=1669905281&sr=8-190
Simple Kind to Skin Moisturising Facial Wash (150ml)  ,4.6 out of 5 stars,972,https://amazon.com/Simple-Kind-Moisturising-Facial-150ml/dp/B0034ZP4TU/ref=sr_1_191?keywords=face+wash&qid=1669905281&sr=8-191
"TBH Kids Gentle Gel Face Wash for Kids, Preteens, and Teens with Sensitive Dry Oily Skin - Gentle Facial Cleanser and Hydrating Facewash for Girls and Boys - Sulfate Free, Paraben Free - 6 Oz  ",4.4 out of 5 stars,729,https://amazon.com/Kids-Gentle-Preteens-Teens-Sensitive/dp/B07HY5XS4Q/ref=sr_1_192?keywords=face+wash&qid=1669905281&sr=8-192
"AROMATICA Tea Tree Balancing Foaming Cleanser 6.35oz / 180g, Vegan, EWG VERIFIED, Packaging may vary  ",4.7 out of 5 stars,1215,https://amazon.com/AROMATICA-Tree-Balancing-Foaming-Cleanser/dp/B076CXKV72/ref=sr_1_193?keywords=face+wash&qid=1669905281&sr=8-193
"Simple Moisturizing Facial Wash, 5 Ounce (Pack of 3)  ",4.7 out of 5 stars,1539,https://amazon.com/Simple-Moisturizing-Facial-Wash-Ounce/dp/B0128FT546/ref=sr_1_194?keywords=face+wash&qid=1669905281&sr=8-194
"Natural Outcome Teen Skin Ultra Gentle Kids Face Wash | Daily Soothing Kid Facial Wash | Natural Non-toxic Ingredients | For Teens, Preteens & Kids Looking to Prevent Acne | Fragrance Free | 5 oz  ",4.9 out of 5 stars,1134,https://amazon.com/Soothing-Non-toxic-Ingredients-Preteens-Fragrance/dp/B0B94T5M2R/ref=sr_1_195?keywords=face+wash&qid=1669905281&sr=8-195
"Aveeno Positively Radiant 60 Second In-Shower Facial Cleanser, Brightening Mask With Moisture-Rich Soy, Lemon Peel Extract, Glycolic Acid, and Kaolin Clay, 5 oz (Pack of 3)  ",4.7 out of 5 stars,1782,https://amazon.com/Aveeno-Positively-Cleanser-Brightening-Moisture-Rich/dp/B01LTHKWCI/ref=sr_1_197?keywords=face+wash&qid=1669905281&sr=8-197
"Bare Escentuals Pure Plush Deep Cleansing Foam, 4.2 Oz  ",4.8 out of 5 stars,1296,https://amazon.com/bareMinerals-Pure-Plush-Cleansing-Ounce/dp/B01B8J31D4/ref=sr_1_198?keywords=face+wash&qid=1669905281&sr=8-198
"Neutrogena Acne Proofing Daily Facial Scrub with Salicylic Acid Acne Treatment, Exfoliating and Cleansing Face Wash, Oil-Free, 4.2 oz  ",4.6 out of 5 stars,972,https://amazon.com/Neutrogena-Salicylic-Treatment-Exfoliating-Cleansing/dp/B075X1WJKQ/ref=sr_1_199?keywords=face+wash&qid=1669905281&sr=8-199
"DERMA E Acne Deep Pore Cleansing Wash – Blemish Control Facial Cleanser with Salicylic Acid - Gentle Oil Control Face Wash Soothes and Balances Skin, 6 fl oz  ",4.5 out of 5 stars,648,https://amazon.com/DERMA-Acne-Deep-Pore-Cleansing/dp/B0011DIWGY/ref=sr_1_200?keywords=face+wash&qid=1669905281&sr=8-200
"Neutrogena Deep Clean Daily Facial Cleanser with Beta Hydroxy Acid for Normal to Oily Skin, Alcohol-Free, Oil-Free & Non-Comedogenic, 6.7 fl. oz (Pack of 3)  ",4.8 out of 5 stars,2268,https://amazon.com/Neutrogena-Cleanser-Alcohol-Free-Oil-Free-Non-Comedogenic/dp/B001ECQ35Y/ref=sr_1_201?keywords=face+wash&qid=1669905281&sr=8-201
"boscia Clear Complexion Cleanser - Vegan Cruelty-Free Daily Face Wash & Pore Minimizer, Natural Clean Skincare. Acne & Blackhead Remover, 5 fl oz  ",4.6 out of 5 stars,2592,https://amazon.com/boscia-Clear-Complexion-Cleanser-Exfoliating/dp/B07PPNMW27/ref=sr_1_202?keywords=face+wash&qid=1669905281&sr=8-202
"Face Wash – Face Cleanser For Women & Mens Face Wash, Facial Cleanser with Clean Ingredients, Great for Acne or Combination and Oily Skin  ",4.5 out of 5 stars,1944,https://amazon.com/Face-Wash-Treatment-Cleanser-Ingredients/dp/B011QT3JR4/ref=sr_1_203?keywords=face+wash&qid=1669905281&sr=8-203
"St. Ives Blackhead Clearing Face Scrub Clears Blackheads & Unclogs Pores Green Tea & Bamboo With Oil-Free Salicylic Acid Acne Medication, Made with 100% Natural Exfoliants 6 oz  ",4.6 out of 5 stars,243,https://amazon.com/St-Ives-Blackhead-Clearing-Scrub/dp/B00M8G8WKY/ref=sr_1_204?keywords=face+wash&qid=1669905281&sr=8-204
