product,rating,price,product url
Elitech Digital Temperature Humidity Data Logger Medical Refrigerator Thermometer Vaccine Fridge Temperature Monitor Max Min Value GSP-6G  ,4.2 out of 5 stars,3645,https://amazon.com/gp/slredirect/picassoRedirect.html/ref=pa_sp_atf_next_aps_sr_pg4_1?ie=UTF8&adId=A007633732NYGUST9TIC5&qualifier=1669578315&id=4443158540539685&widgetName=sp_atf_next&url=%2FElitech-Temperature-Humidity-Recorder-External%2Fdp%2FB084X1DB38%2Fref%3Dsr_1_49_sspa%3Fkeywords%3Dfridge%26qid%3D1669578315%26sr%3D8-49-spons%26psc%3D1
"Smad Compact Mini Fridge Quiet No Noise Absorption Refrigerator with Lock 40L 1.4 cu.ft, Black  ",3.5 out of 5 stars,29079,https://amazon.com/gp/slredirect/picassoRedirect.html/ref=pa_sp_atf_next_aps_sr_pg4_1?ie=UTF8&adId=A03394141E4F6VT2L1RUZ&qualifier=1669578315&id=4443158540539685&widgetName=sp_atf_next&url=%2FCompact-Fridge-Quiet-Noise-Refrigerator%2Fdp%2FB01MRPM7MK%2Fref%3Dsr_1_50_sspa%3Fkeywords%3Dfridge%26qid%3D1669578315%26sr%3D8-50-spons%26psc%3D1
"Exqulife Mini Fridge for Bedroom,8L AC/DC Thermometric Cool and Warm Small Refrigerator,Personal Portable Skincare Fridge for Office,Car,Dorm,Foods,Beverage,Skin Care,Breast Milk,25dB,White  ",3.7 out of 5 stars,3483,https://amazon.com/Exqulife-Thermometric-Refrigerator-Personal-Portable/dp/B0B2F6KNLW/ref=sr_1_51?keywords=fridge&qid=1669578315&sr=8-51
"Cegsin Mini Fridge for Bedroom, 7 Liter AC/DC Portable Beauty Fridge Thermoelectric Cooler and Warmer, Quiet Compact Fridge For Skincare, Beverage, Food, Cosmetics, Home, Office and Car (White)  ",4.3 out of 5 stars,4455,https://amazon.com/Cegsin-Portable-Thermoelectric-Skincare-Cosmetics/dp/B09XF8YRPB/ref=sr_1_52?keywords=fridge&qid=1669578315&sr=8-52
"CURTIS EFMIS129-RED Frigidaire Retro Mini Compact Beverage Refrigerator, for Keeping Office Lunch Cool (RED)  ",4.0 out of 5 stars,2349,https://amazon.com/Frigidaire-Compact-Beverage-Refrigerator-keeping/dp/B07K6XBPPL/ref=sr_1_53?keywords=fridge&qid=1669578315&sr=8-53
"QUBI Mini Fridge, Professional Skincare Fridge, Mini Cosmetics Makeup Fridge, Compact Fridge 5 Liter (Cream White, 5L)  ",4.5 out of 5 stars,8424,https://amazon.com/QUBI-Professional-Skincare-Cosmetics-Compact/dp/B08G4RK3N9/ref=sr_1_54?keywords=fridge&qid=1669578315&sr=8-54
"Frigidaire EFMIS171-BLACK 6+1 Retro Mini Portable Personal Fridge/Cooler for Home, Office or Dorm with Active Cooling Can Holder on Top, Black, standard  ",4.3 out of 5 stars,3969,https://amazon.com/Frigidaire-EFMIS171-BLACK-Portable-Personal-Cooling/dp/B093213246/ref=sr_1_56?keywords=fridge&qid=1669578315&sr=8-56
"BLACK+DECKER BCRK17W Compact Refrigerator Energy Star Single Door Mini Fridge with Freezer, 1.7 Cubic Ft., White  ",4.5 out of 5 stars,12069,https://amazon.com/BLACK-DECKER-BCRK17W-Compact-Refrigerator/dp/B01DZQI7B4/ref=sr_1_57?keywords=fridge&qid=1669578315&sr=8-57
"Aidek Cosmetic Mini Fridge for Skin Care/Makeup, 4L Portable Beauty Fridges for Bedroom, Dorm, Office, Small Refrigerator with Cool & Heat, AC/DC12v Car Cooler for Desktop and Travel (Pearl Black)  ",4.8 out of 5 stars,3807,https://amazon.com/Aidek-Cosmetic-Portable-Personal-Refrigerator/dp/B0B9Y4NK4Y/ref=sr_1_58?keywords=fridge&qid=1669578315&sr=8-58
"Homieasy End Table with Charging Station, 20 Inch Square Side Table with USB Ports & Power Outlets, Grey Nightstand with 2-Tier Storage Shelf, Mini Fridge Stand for Small Spaces, Black Oak - 2 Pack  ",4.8 out of 5 stars,9639,https://amazon.com/gp/slredirect/picassoRedirect.html/ref=pa_sp_mtf_aps_sr_pg4_1?ie=UTF8&adId=A00734382Y8ZBPKF11ZGU&qualifier=1669578315&id=4443158540539685&widgetName=sp_mtf&url=%2FHomieasy-Charging-Station-Outlets-Nightstand%2Fdp%2FB0BDL424XH%2Fref%3Dsr_1_59_sspa%3Fkeywords%3Dfridge%26qid%3D1669578315%26sr%3D8-59-spons%26psc%3D1
"50pcs Fridge Magnets Refrigerator Magnets, Small Round Neodymium Magnets, Magnets for Crafts, Home, Office  ",4.8 out of 5 stars,486,https://amazon.com/gp/slredirect/picassoRedirect.html/ref=pa_sp_mtf_aps_sr_pg4_1?ie=UTF8&adId=A02339473BFULIPJ0JTRY&qualifier=1669578315&id=4443158540539685&widgetName=sp_mtf&url=%2FFridge-Magnets-Refrigerator-Neodymium-Crafts%2Fdp%2FB0B9SG1G72%2Fref%3Dsr_1_60_sspa%3Fkeywords%3Dfridge%26qid%3D1669578315%26sr%3D8-60-spons%26psc%3D1
"Silonn Mini Fridge, Portable Skin Care Fridge, 4 L/6 Can Cooler and Warmer Small Refrigerator with Eco Friendly for Home, Office and Car, Compact Refrigerator and White  ",4.5 out of 5 stars,3807,https://amazon.com/Silonn-Portable-Refrigerator-Friendly-Compact/dp/B0B51F4R95/ref=sr_1_61?keywords=fridge&qid=1669578315&sr=8-61
"Living Enrichment Mini Fridge 4L 6 Can Skincare Fridge, AC 100-120V Portable Small Refrigerator for Skincare, Beverage, Food, Cosmetics, Home, Office - Stone White  ",4.5 out of 5 stars,4131,https://amazon.com/enrichment-Skincare-100-120V-Portable-Cosmetics/dp/B09W9LMM9F/ref=sr_1_62?keywords=fridge&qid=1669578315&sr=8-62
"RCA RFR321-FR320/8 IGLOO Mini Refrigerator, 3.2 Cu Ft Fridge, Blue  ",4.4 out of 5 stars,17010,https://amazon.com/RCA-RFR321-FR320-IGLOO-Refrigerator-Fridge/dp/B0116QNKXU/ref=sr_1_63?keywords=fridge&qid=1669578315&sr=8-63
FaceTory Portable Mint Beauty Fridge (10-L / 12 Can) with Heat and Cool Capacity  ,4.4 out of 5 stars,5589,https://amazon.com/FaceTory-Portable-Beauty-Fridge-Capacity/dp/B0815B2Z61/ref=sr_1_65?keywords=fridge&qid=1669578315&sr=8-65
"Ecowell WRE100 Mini, 4 Liter/6 Can Small Refrigerator-AC/DC Cooler & Warmer for Bedroom Dorm Car Office Desk-Portable Compact Tiny Skincare Fridge for Skin Care Cosmetic Makeup, White  ",4.1 out of 5 stars,3159,https://amazon.com/Ecowell-WRE100-Refrigerator-AC-Desk-Portable-Skincare/dp/B0BBZ1BCGP/ref=sr_1_66?keywords=fridge&qid=1669578315&sr=8-66
"Cooluli Skincare Mini Fridge for Bedroom - Car, Office Desk & Dorm Room - Portable 4L/6 Can Electric Plug In Cooler & Warmer for Food, Drinks, Beauty & Makeup - 12v AC/DC & Exclusive USB Option, Pink  ",4.5 out of 5 stars,3969,https://amazon.com/Cooluli-Fridge-Electric-Cooler-Warmer/dp/B01G7IL51Q/ref=sr_1_67?keywords=fridge&qid=1669578315&sr=8-67
"Living Enrichment Mini Fridge Chilling and Warming, Portable Compact Refrigerator AC/DC Power, 4L 6 Cans Capacity, for Skincare, Foods, Medications, Milk, Home and Travel - White  ",4.2 out of 5 stars,3240,https://amazon.com/Living-Enrichment-Personal-TMF-4R-White-Portable/dp/B08G54RG9P/ref=sr_1_68?keywords=fridge&qid=1669578315&sr=8-68
"2 Pack Refrigerator Organizer Bins with Pull-out Drawer, Stackable Clear Fridge Drawer Organizer, Organization and Storage with Handle for Kitchen, Pantry, Fridge, Freezer.  ",4.6 out of 5 stars,1944,https://amazon.com/gp/slredirect/picassoRedirect.html/ref=pa_sp_btf_aps_sr_pg4_1?ie=UTF8&adId=A09445323GRCDMKU0KVAM&qualifier=1669578315&id=4443158540539685&widgetName=sp_btf&url=%2FRefrigerator-Organizer-Pull-out-Stackable-Organization%2Fdp%2FB0B7GB9R42%2Fref%3Dsr_1_69_sspa%3Fkeywords%3Dfridge%26qid%3D1669578315%26sr%3D8-69-spons%26psc%3D1
"20 Pack Refrigerator Magnets,Strong Fridge Magnets, Magnet Clips Heavy Duty,Clip Magnets for Fridge,Whiteboard, Office, Black Magnetic Clips  ",4.4 out of 5 stars,486,https://amazon.com/gp/slredirect/picassoRedirect.html/ref=pa_sp_btf_aps_sr_pg4_1?ie=UTF8&adId=A0358406Z40EJO9X74D9&qualifier=1669578315&id=4443158540539685&widgetName=sp_btf&url=%2FRefrigerator-Magnets-Strong-Whiteboard-Magnetic%2Fdp%2FB09WTJZVCW%2Fref%3Dsr_1_70_sspa%3Fkeywords%3Dfridge%26qid%3D1669578315%26sr%3D8-70-spons%26psc%3D1%26smid%3DA35842ASBR1GKG
