product,rating,price,product url
"LOVFIVE Bluetooth Speakers, 10W Fast Wireless Charger for iPhone Android and More, Speakers Bluetooth Wireless with Light, Portable Bluetooth Speaker Supported TF Card, Great Birthday Gifts for Lovers  ",5.0 out of 5 stars,2069,https://amazon.com/gp/slredirect/picassoRedirect.html/ref=pa_sp_atf_next_aps_sr_pg4_1?ie=UTF8&adId=A10410073BUC0WZ4XCRT8&qualifier=1683532685&id=1405818761908694&widgetName=sp_atf_next&url=%2FLOVFIVE-Bluetooth-Speakers-Wireless-Supported%2Fdp%2FB0BZ836PHL%2Fref%3Dsr_1_49_sspa%3Fkeywords%3Diphone%26qid%3D1683532685%26sr%3D8-49-spons%26psc%3D1
"TCL 40XL Unlocked Cell Phone 4GB + 128GB, 6.75"" 90Hz Display, Smartphone Android 13, 50MP AI Camera Mobile Phone, 5000 mAh, Dark Gray  ",5.0 out of 5 stars,12331,https://amazon.com/gp/slredirect/picassoRedirect.html/ref=pa_sp_atf_next_aps_sr_pg4_1?ie=UTF8&adId=A03274421ZY0R61AY0JFE&qualifier=1683532685&id=1405818761908694&widgetName=sp_atf_next&url=%2FTCL-Unlocked-Display-Smartphone-Android%2Fdp%2FB0BTP6PJ9J%2Fref%3Dsr_1_50_sspa%3Fkeywords%3Diphone%26qid%3D1683532685%26sr%3D8-50-spons%26psc%3D1
6.7Inch Unlocked Cell Phone Android Phones 2GB RAM+16GB ROM Full Screen Straight Talk Phone Dual Sim Boost Mobile Phones Smart Phones Unlocked New for Android10.0(Gold)  ,2.7 out of 5 stars,7366,https://amazon.com/6-7Inch-Unlocked-Android-Straight-Android10-0/dp/B0BRB5N9W1/ref=sr_1_51?keywords=iphone&qid=1683532685&sr=8-51
Google Pixel 6 – 5G Android Phone - Unlocked Smartphone with Wide and Ultrawide Lens - 128GB - Stormy Black  ,4.3 out of 5 stars,33021,https://amazon.com/Google-Pixel-Unlocked-Smartphone-Ultrawide/dp/B09HJZPFDD/ref=sr_1_52?keywords=iphone&qid=1683532685&sr=8-52
"Total by Verizon Motorola Moto g Pure, 32GB, Blue - Prepaid Smartphone (Locked)  ",3.8 out of 5 stars,4055,https://amazon.com/Total-Verizon-Motorola-Moto-Pure/dp/B0BBXGV3PP/ref=sr_1_53?keywords=iphone&qid=1683532685&sr=8-53
"Samsung Galaxy A13 (SM-A135M/DS) Dual SIM,32 GB 3GB RAM, Factory Unlocked GSM, International Version - No Warranty - (Black)  ",4.0 out of 5 stars,12580,https://amazon.com/Samsung-SM-A135M-DS-Unlocked-International/dp/B09X62XYCB/ref=sr_1_54?keywords=iphone&qid=1683532685&sr=8-54
"Dilwe 6.1'' Pro Unlocked Cellphone, 4GB 64GB Dual SIM Card 4G Network Mobile Phone, Face ID Unlocked Smartphone for Android 11 4000mah Battery(6.1'' ), 6.1'' Blue  ",1.9 out of 5 stars,6869,https://amazon.com/Dilwe-Unlocked-Cellphone-Network-Smartphone/dp/B0B5ZKP267/ref=sr_1_55?keywords=iphone&qid=1683532685&sr=8-55
"iP13 Pro MAX Unlocked Smartphone, 6.1in 3GB 32GB Face ID Cell Phone Unlocked for Android 6.0, MT6799 10 Core,Dual SIM, 5MP 8MP Dual Camera, 2800mAh Mobile Phone Support 128GB Expandable(White)  ",3.0 out of 5 stars,8110,https://amazon.com/Unlocked-Smartphone-Android-2800mAh-Expandable/dp/B0B2KG3LD8/ref=sr_1_56?keywords=iphone&qid=1683532685&sr=8-56
"6.1Inch HD Screen Unlocked Cellphone, 4G Cellphone Dual SIM Slots,4GB RAM 64GB ROM, Face ID Unlocked Mobile Phone for Android 11 4000mAh(Gold 6.1"")  ",5.0 out of 5 stars,6373,https://amazon.com/6-1Inch-Unlocked-Cellphone-Android-4000mAh/dp/B0BFSTMFWM/ref=sr_1_57?keywords=iphone&qid=1683532685&sr=8-57
"SAMSUNG Galaxy A23 (SM-A235M/DS) Dual SIM,64 GB 4GB RAM, Factory Unlocked GSM, International Version - No Warranty - (Blue)  ",4.3 out of 5 stars,16469,https://amazon.com/Samsung-SM-A235M-DS-Unlocked-International/dp/B09W382BTT/ref=sr_1_58?keywords=iphone&qid=1683532685&sr=8-58
"TCL 30 SE |2022| Unlocked Cell Phone 4+128GB, 6.52"" Android Phone GSM Unlocked Smartphone with 50MP Camera, 5000mAh, Single SIM, US Version, Atlantic Blue (Not Support Verizon/Boost/5G)  ",4.1 out of 5 stars,11504,https://amazon.com/TCL-Unlocked-Smartphone-Atlantic-Compatible/dp/B09XV6JJCF/ref=sr_1_59?keywords=iphone&qid=1683532685&sr=8-59
"Zunate I14pro Max 4G Smartphone, 6.1in HD Screen Phone for Android 11 with Navigation System, Dual SIM 4GB RAM 64GB ROM 8MP 16MP 4000mAh Battery Unlocked Mobile Phone for Senior(White)  ",2.8 out of 5 stars,9931,https://amazon.com/Zunate-Smartphone-Android-Navigation-Unlocked/dp/B0B5Y9HF6R/ref=sr_1_60?keywords=iphone&qid=1683532685&sr=8-60
Google - Pixel 3 XL with 64GB Memory Cell Phone (Unlocked) - Clearly White  ,4.4 out of 5 stars,22262,https://amazon.com/Google-Pixel-Memory-Unlocked-Clearly/dp/B07P8MQD6F/ref=sr_1_61?keywords=iphone&qid=1683532685&sr=8-61
Google Pixel 4 - Just Black - 64GB - Unlocked  ,4.2 out of 5 stars,14814,https://amazon.com/Google-GA01187-US-Pixel-Black-Unlocked/dp/B07YMNLXL3/ref=sr_1_62?keywords=iphone&qid=1683532685&sr=8-62
"UMIDIGI Unlocked Cell Phone, 128GB, NFC, Fingerprint Reader, 6.7"" HD Screen, F3S Unlocked Android Phones, Dual 4G Volte, with Sony 48MP Camera, 5150mAh Battery, Android 11  ",3.7 out of 5 stars,15642,https://amazon.com/Unlocked-Fingerprint-UMIDIGI-F3S-Android/dp/B0B212YX1K/ref=sr_1_65?keywords=iphone&qid=1683532685&sr=8-65
Smallest Mobile Phone L8Star BM70 Tiny Mini Mobile Black Unlocked  ,3.5 out of 5 stars,1821,https://amazon.com/Smallest-Mobile-Phone-L8Star-Unlocked/dp/B0759QPPKN/ref=sr_1_66?keywords=iphone&qid=1683532685&sr=8-66
