product,rating,price,product url
"30 Packs Heave Duty Badge Reels Retractable with Carabiner Belt Clip and Key Ring, Badge Holders for ID Card Name Keychain(Black, 26.5 Inch Pull Cord)  ",4.4 out of 5 stars,2187,https://amazon.com/gp/slredirect/picassoRedirect.html/ref=pa_sp_atf_next_aps_sr_pg4_1?ie=UTF8&adId=A06269731JKB3QKLKUYM9&qualifier=1669569724&id=5218193669473644&widgetName=sp_atf_next&url=%2FPacks-Retractable-Carabiner-Holders-Keychain%2Fdp%2FB09W5MBXHP%2Fref%3Dsr_1_145_sspa%3Fkeywords%3Dname%26qid%3D1669569724%26sr%3D8-145-spons%26psc%3D1
"Methdic 5 Colors (Hello My Name is) Name Tags Stickers 400 Labels for Office, Meeting, School, Teachers and Mailing  ",4.7 out of 5 stars,648,https://amazon.com/gp/slredirect/picassoRedirect.html/ref=pa_sp_atf_next_aps_sr_pg4_1?ie=UTF8&adId=A0853114189TP4SRZMHAZ&qualifier=1669569724&id=5218193669473644&widgetName=sp_atf_next&url=%2FMethdic-Stickers-Meeting-Teachers-Mailing%2Fdp%2FB07WF9YFWY%2Fref%3Dsr_1_148_sspa%3Fkeywords%3Dname%26qid%3D1669569724%26sr%3D8-148-spons%26psc%3D1
Sperry Women's Saltwater Core Boots  ,4.7 out of 5 stars,10206,https://amazon.com/Sperry-Womens-Saltwater-Chevron-Quilt/dp/B07KQQD5W6/ref=sr_1_150?keywords=name&qid=1669569724&sr=8-150
"150 Pcs 2"" x 3""Natural Kraft Tags Sticker Self-Adhesive Customize Holiday Present Stickers Labels for Jars, Christmas Gift, Name Tags, , Mason Jars Christmas Stickers-A  ",4.6 out of 5 stars,486,https://amazon.com/Self-Adhesive-Customize-Stickers-Christmas-Stickers/dp/B08WZ2D286/ref=sr_1_151?keywords=name&qid=1669569724&sr=8-151
Reunited - School Class Reunion Party Funny Name Tags - Party Badges Sticker Set of 12  ,4.8 out of 5 stars,891,https://amazon.com/Reunited-School-Reunion-Badges-Sticker/dp/B07DTJGZK9/ref=sr_1_152?keywords=name&qid=1669569724&sr=8-152
Deekin 10 Pieces Christmas Stocking Name Tags Buffalo Plaid Christmas Ornaments Snowflake Stocking Name Tags Xmas Stocking Name Labels with Bead and Bow for Xmas Tree  ,4.6 out of 5 stars,1296,https://amazon.com/Deekin-Christmas-Stocking-Ornaments-Snowflake/dp/B09J163WGN/ref=sr_1_153?keywords=name&qid=1669569724&sr=8-153
100 Pieces Name Tags with Pins 1 x 3 Inches Blank Name Tags Name Badge with Pins Name ID Badge Holder Name Tags for Office Workers Students Employee Custom (Gold)  ,4.6 out of 5 stars,2187,https://amazon.com/Pieces-Inches-Workers-Students-Employee/dp/B09YLV59J3/ref=sr_1_155?keywords=name&qid=1669569724&sr=8-155
Alternative Pop  ,1.0 out of 5 stars,81,https://amazon.com/Name/dp/B0015AHTYE/ref=sr_1_156?keywords=name&qid=1669569724&sr=8-156
Levi's Mens Boxer Briefs Cotton Stretch Underwear For Men 4 Pack  ,4.2 out of 5 stars,1701,https://amazon.com/Levis-Stretch-Boxer-Underwear-Breathable/dp/B082DLSMZN/ref=sr_1_157?keywords=name&qid=1669569724&sr=8-157
"350 Pack Hello My Name is Stickers Identification Badges, 3.5"" X 2.25"" Peel and Stick for Conferences, Offices and Schools - Made in The USA (Blue 1 Pack)  ",4.7 out of 5 stars,567,https://amazon.com/Stickers-Identification-Conferences-Offices-Schools/dp/B0898THMXC/ref=sr_1_158?keywords=name&qid=1669569724&sr=8-158
Under Armour Women's Rival Fleece Logo Hoodie  ,4.6 out of 5 stars,3159,https://amazon.com/Under-Armour-Rival-Fleece-Hoodie/dp/B07YXL49LP/ref=sr_1_159?keywords=name&qid=1669569724&sr=8-159
12 Pieces Christmas Stocking Name Tag Wood Stocking Tags Wood Tags Dog Stocking Tags with Buffalo Plaid Bows and 4 Letter Stickers for Christmas Holiday Decoration (Multi Colors)  ,4.4 out of 5 stars,729,https://amazon.com/Christmas-Stocking-Buffalo-Stickers-Decoration/dp/B09J21ZTZ3/ref=sr_1_160?keywords=name&qid=1669569724&sr=8-160
MOMOL Small Initial Necklace for Women Stainless Steel Tiny Letter Necklace Personalized Name Necklace for Girls  ,4.5 out of 5 stars,810,https://amazon.com/gp/slredirect/picassoRedirect.html/ref=pa_sp_mtf_aps_sr_pg4_1?ie=UTF8&adId=A092262118A8LUL6TSEK8&qualifier=1669569724&id=5218193669473644&widgetName=sp_mtf&url=%2FMOMOL-Initial-Necklace-Stainless-Personalized%2Fdp%2FB08NPPHK64%2Fref%3Dsr_1_161_sspa%3Fkeywords%3Dname%26qid%3D1669569724%26sr%3D8-161-spons%26psc%3D1
"ARIAT Women's Aztec Name Mesh Snap Back Cap, Grey, Turquoise, Coral, One Size  ",4.8 out of 5 stars,1944,https://amazon.com/Ariat-Womens-Aztec-Turquoise-Coral/dp/B0757HH2BK/ref=sr_1_165?keywords=name&qid=1669569724&sr=8-165
50 Sets Badge Holders and Metal Clips Clear Horizontal Name Tag ID Card Holder with Clip Waterproof ID Badge Holder with Metal Clips  ,4.7 out of 5 stars,1215,https://amazon.com/Badge-Holders-Horizontal-Holder-Waterproof/dp/B09KRQ1PXB/ref=sr_1_166?keywords=name&qid=1669569724&sr=8-166
Tommy Hilfiger Men's Genuine Leather Passcase Wallet with Multiple Card Slots  ,4.7 out of 5 stars,2349,https://amazon.com/Tommy-Hilfiger-Mens-Leather-Wallet/dp/B00422M6JK/ref=sr_1_167?keywords=name&qid=1669569724&sr=8-167
His Name Was Jason: 30 Years of Friday the 13th (2 Disc Splatter Edition)  ,4.7 out of 5 stars,567,https://amazon.com/His-Name-Was-Jason-Splatter/dp/B001L9EXNO/ref=sr_1_168?keywords=name&qid=1669569724&sr=8-168
adidas Women's Badge of Sport Tee  ,4.6 out of 5 stars,1782,https://amazon.com/adidas-Basic-Badge-Medium-Heather/dp/B07KS8QLV3/ref=sr_1_169?keywords=name&qid=1669569724&sr=8-169
"150 Packs Magnetic Name Tags Reusable Magnetic Name Badge Holder Metal ID Tag Magnet Backing with 3 Magnet Pins for School Classroom, Work and More  ",4.7 out of 5 stars,3402,https://amazon.com/Magnetic-Reusable-Holder-Backing-Classroom/dp/B0B1ZVBX3V/ref=sr_1_170?keywords=name&qid=1669569724&sr=8-170
Columbia Women's Heavenly Water Resistant Insulated Vest  ,4.8 out of 5 stars,6642,https://amazon.com/Columbia-Womens-Heavenly-Black-X-Small/dp/B01N1MW66Z/ref=sr_1_171?keywords=name&qid=1669569724&sr=8-171
"Chevron Solids Name Plates, CTP Classroom Decoration, 36 Pieces (Creative Teaching Press 4517)  ",4.8 out of 5 stars,405,https://amazon.com/Creative-Teaching-Press-Chevron-Solids/dp/B00JF8VS40/ref=sr_1_172?keywords=name&qid=1669569724&sr=8-172
"50Pcs Metal Badge Clips with Clear PVC Straps, Premium Double Hole Metal Badge Clips for ID Cards, Badge Holders, Name Tags Work Badges  ",4.8 out of 5 stars,567,https://amazon.com/Straps-Premium-Double-Holders-Badges/dp/B09KHFHN8M/ref=sr_1_174?keywords=name&qid=1669569724&sr=8-174
Kate Spade New York Women's Akira Polarized Rectangular Sunglasses  ,4.5 out of 5 stars,5913,https://amazon.com/Kate-Spade-Polarized-Rectangular-Sunglasses/dp/B00EOH3UWU/ref=sr_1_175?keywords=name&qid=1669569724&sr=8-175
"The Mighty Badge by Avery, 1"" x 3"" Silver Name Tags, 10 ID Badges, 80 Inserts for Laser Printers (71206)  ",4.5 out of 5 stars,7290,https://amazon.com/Avery-Magnetic-Customizable-Inserts-71206/dp/B07PQ9BH4J/ref=sr_1_176?keywords=name&qid=1669569724&sr=8-176
"BETCKEY - Compatible Address/Barcode Labels Replacement for Brother DK-1209 (2-3/7"" x 1-1/7""), Use with Brother QL Label Printers [10 Rolls/8000 Labels]  ",4.7 out of 5 stars,3159,https://amazon.com/gp/slredirect/picassoRedirect.html/ref=pa_sp_mtf_aps_sr_pg4_1?ie=UTF8&adId=A0776387173XJ9R1QOPTK&qualifier=1669569724&id=5218193669473644&widgetName=sp_mtf&url=%2FBrother-Compatible-DK-1209-Address-Barcode-Labels%2Fdp%2FB01LYLE1EJ%2Fref%3Dsr_1_177_sspa%3Fkeywords%3Dname%26qid%3D1669569724%26sr%3D8-177-spons%26psc%3D1
"Supfive Sheet Shipping Labels, Permanent Adhesive Address Labels 2-1/2 x 4 inch, 8 Per Sheet, (100 Sheet, 800 Labels)  ",3.4 out of 5 stars,972,https://amazon.com/gp/slredirect/picassoRedirect.html/ref=pa_sp_mtf_aps_sr_pg4_1?ie=UTF8&adId=A070691615YMDNZ94T0CK&qualifier=1669569724&id=5218193669473644&widgetName=sp_mtf&url=%2FSupfive-Shipping-Permanent-Adhesive-Address%2Fdp%2FB097Y79646%2Fref%3Dsr_1_178_sspa%3Fkeywords%3Dname%26qid%3D1669569724%26sr%3D8-178-spons%26psc%3D1
"Labelebal Compatible 2-3/7"" x 100' Direct Thermal Continuous Length Labels Replacement for DK-2205 Shipping Mailing Postage Compatible for Brother QL Printer (12 Rolls + 1 Frame, 30.48m Labels/Roll)…  ",4.5 out of 5 stars,2187,https://amazon.com/gp/slredirect/picassoRedirect.html/ref=pa_sp_mtf_aps_sr_pg4_1?ie=UTF8&adId=A00272631XOL4TBNEWYM&qualifier=1669569724&id=5218193669473644&widgetName=sp_mtf&url=%2FLabelebal-Compatible-Brother-Shipping-Continuous%2Fdp%2FB08JGPZ3DY%2Fref%3Dsr_1_179_sspa%3Fkeywords%3Dname%26qid%3D1669569724%26sr%3D8-179-spons%26psc%3D1
3000 Blank Address Label White Shipping Labels for Laser and Inkjet Printers Adhesive Mailing Labels Postage Labels for Shipping Boxes Mailer (1*2.625In)  ,4.2 out of 5 stars,972,https://amazon.com/gp/slredirect/picassoRedirect.html/ref=pa_sp_mtf_aps_sr_pg4_1?ie=UTF8&adId=A06155131IILHKUH3BHF3&qualifier=1669569724&id=5218193669473644&widgetName=sp_mtf&url=%2FAddress-Shipping-Printers-Adhesive-Mailing%2Fdp%2FB09QHSN87G%2Fref%3Dsr_1_180_sspa%3Fkeywords%3Dname%26qid%3D1669569724%26sr%3D8-180-spons%26psc%3D1
Tommy Hilfiger Men's Short Sleeve Signature Stripe Graphic T-Shirt  ,4.6 out of 5 stars,3402,https://amazon.com/Tommy-Hilfiger-Short-Sleeve-T-Shirt/dp/B07STFTL7G/ref=sr_1_181?keywords=name&qid=1669569724&sr=8-181
"Avery Customizable Name Badge Clips, 3"" x 4"", White, 100 Printable Inserts and Badge Holders with Clips (74541)  ",4.7 out of 5 stars,3888,https://amazon.com/Avery-Badges-Print-Inserts-Holders/dp/B00007LP9Y/ref=sr_1_182?keywords=name&qid=1669569724&sr=8-182
adidas Originals Kid's Swift Essential Sneaker  ,4.6 out of 5 stars,2997,https://amazon.com/adidas-Originals-Swift-Essential-Sneaker/dp/B0828W6G4X/ref=sr_1_183?keywords=name&qid=1669569724&sr=8-183
Jetec 6 Pieces Christmas Stocking Tags Wood Name Ornaments Farmhouse Personalized Stocking Tag with Buffalo Ribbon and Wooden Beads DIY Wooden Craft Hanging Tags for Christmas Stocking Decor  ,4.6 out of 5 stars,567,https://amazon.com/Jetec-Christmas-Ornaments-Farmhouse-Personalized/dp/B099NMKPJQ/ref=sr_1_185?keywords=name&qid=1669569724&sr=8-185
"Coach Men's 3 in 1 Wallet (Signature Canvas, Coach Patch - Gunmetal/Chalk/Candied Orange Multi)  ",4.5 out of 5 stars,8100,https://amazon.com/Coach-Wallet-Signature-Canvas-Patch/dp/B09Z76V637/ref=sr_1_186?keywords=name&qid=1669569724&sr=8-186
"Richboom 10 Pack Acrylic Wall Name Plate Holder 2 x 8 Inch, Clear Acrylic Sign Holder Frame with Adhesive Tapes, Door Plates for Home, Office, Classroom  ",4.4 out of 5 stars,1539,https://amazon.com/Acrylic-Holder-Plastic-Adhesive-Classroom/dp/B095YM72PF/ref=sr_1_187?keywords=name&qid=1669569724&sr=8-187
Nike Women's Tennis Shoes  ,4.5 out of 5 stars,6075,https://amazon.com/NIKE-Womens-Royale-Sneaker-Regular/dp/B07CYGHPNC/ref=sr_1_190?keywords=name&qid=1669569724&sr=8-190
24 Pieces Names of Jesus Christ Christmas Ornament Wood Jesus Christ Ornaments with Different Names of The Savior Wooden Religious Ornaments Advent Calendar Xmas Tree Name Tags (Classic Style)  ,1.0 out of 5 stars,1053,https://amazon.com/Christmas-Ornament-Ornaments-Different-Religious/dp/B0BJ25DKM2/ref=sr_1_191?keywords=name&qid=1669569724&sr=8-191
"Christmas Gift Name Tags 60 Count with Untied String -15 Assorted Foil, Printed Designs to and from Labels for Xmas Present Wrapping  ",5.0 out of 5 stars,810,https://amazon.com/Christmas-Assorted-Printed-Designs-Wrapping/dp/B0BFKJ2CY1/ref=sr_1_193?keywords=name&qid=1669569724&sr=8-193
"BARKER CREEK 3-1/2 x 2-3/4"" Name Badges/Self-Adhesive Labels, Gold, 45-Count (LL-1532)  ",4.6 out of 5 stars,567,https://amazon.com/Barker-Badges-Self-Adhesive-45-Count-LL-1532/dp/B00RYCX6W6/ref=sr_1_194?keywords=name&qid=1669569724&sr=8-194
"Kate Spade Paxton 2/S Rectangular Women's Sunglasses, 53mm  ",4.0 out of 5 stars,8343,https://amazon.com/Kate-Spade-Paxton2-Sunglasses-Polarized/dp/B07HQWMYQ7/ref=sr_1_195?keywords=name&qid=1669569724&sr=8-195
Christmas Name Tags Personalized Decorative Name Tag Stickers Self Adhesive Name Labels for Christmas Gift Tags Holiday Classroom Office Home Mailing 3.5 x 2.8 Inch (Elegant Style)  ,4.7 out of 5 stars,972,https://amazon.com/Adhesive-Stickers-Purpose-Personalized-Wedding/dp/B09JWFWSCR/ref=sr_1_196?keywords=name&qid=1669569724&sr=8-196
"2 Pack Luggage Tags, Fintie PU Leather Name ID Labels with Privacy Cover for Travel Bag Suitcase (Genuine Leather-Purple)  ",4.7 out of 5 stars,891,https://amazon.com/Luggage-Suitcase-Fintie-Baggage-Identifiers/dp/B07FMTNL1T/ref=sr_1_197?keywords=name&qid=1669569724&sr=8-197
"120 Pieces Hello Name Tags with Black Marker Pen, Hello My Name is Stickers Newborn Baby Name Sticker Labels for School Office Home  ",4.8 out of 5 stars,567,https://amazon.com/Pieces-Marker-Stickers-Newborn-Sticker/dp/B088BT8RH9/ref=sr_1_198?keywords=name&qid=1669569724&sr=8-198
The Names of God - Women's Bible Study DVD: His Character Revealed  ,4.9 out of 5 stars,3402,https://amazon.com/Names-God-Womens-Character-Revealed/dp/1501878123/ref=sr_1_199?keywords=name&qid=1669569724&sr=8-199
Kate Spade New York Women's Annika Rectangular Sunglasses  ,4.6 out of 5 stars,5265,https://amazon.com/Kate-Spade-Polarized-Rectangular-Sunglasses/dp/B006UH7T1A/ref=sr_1_200?keywords=name&qid=1669569724&sr=8-200
"20 Pack of Magnetic Name Badge Holder Kit, 4” x 3” Horizontal ID Card Name Tag for Conventions, Exhibitors, Events - Can Be Use as Vaccine Card Holder Protector for CDC Immunization Record  ",4.3 out of 5 stars,1620,https://amazon.com/Magnetic-Name-Badge-Holder-Clear/dp/B072Q2T1TM/ref=sr_1_201?keywords=name&qid=1669569724&sr=8-201
Timberland Men's Baseline Leather Canvas Wallet with Attached Flip Pocket  ,4.7 out of 5 stars,1134,https://amazon.com/Timberland-Baseline-Leather-Canvas-Attached/dp/B00TI06VOM/ref=sr_1_202?keywords=name&qid=1669569724&sr=8-202
"Evaster Place Cards Pack of 100 Premium Tent Name Place Cards for Table Setting with Gold Foil Border 2x3.5 inches - Perfect Place Cards for Weddings, Banquets Dinner Parties and any other Events  ",4.7 out of 5 stars,567,https://amazon.com/Evaster-weddings-Premium-border-perfect/dp/B09JN33FHG/ref=sr_1_203?keywords=name&qid=1669569724&sr=8-203
"8 Pieces PU Leather Luggage Bag Case Tags PU Leather Name ID Labels Privacy Luggage Labels for Travel Bag Suitcase (Yellow, Pink, Blue, Brown, Purple, Watermelon Red, Orange, Black)  ",4.6 out of 5 stars,1134,https://amazon.com/Leather-Luggage-Privacy-Suitcase-Watermelon/dp/B091TJ3HLY/ref=sr_1_204?keywords=name&qid=1669569724&sr=8-204
